{
  "time": "2026-10-19T09:30:12Z",
  "runId": "run_42",
  "step": 3,
  "callId": "call_7",
  "tool": "send_email",
  "sideEffects": "irreversible",
  "external": true,
  "mode": "attended",
  "decision": "confirm",
  "outcome": "approved",
  "reasons": ["rule 2: send_email -> confirm", "ruleOfTwo: untrusted content in run, sensitive tool available"],
  "approver": "angel",
  "argumentsDigest": "9f86d081884c7d659a2feaa0c55ad015a3bf4f1b2b0b822cd15d6c15b0f00a08"
}
